    1 2024-05-10 11:04:16.432289  10.244.1.19 → 10.102.252.130 HTTP 305 GET /tools.descartes.teastore.registry/rest/services/tools.descartes.teastore.recommender/ HTTP/1.1 
    2 2024-05-10 11:04:16.432789 10.102.252.130 → 10.244.1.19  HTTP 266 HTTP/1.1 200   (application/json)
    3 2024-05-10 11:04:16.432795  10.244.1.19 → 10.102.252.130 TCP 68 38312 → 8080 [ACK] Seq=238 Ack=199 Win=501 Len=0 TSval=3881993849 TSecr=2075106185
    4 2024-05-10 11:04:16.435149  10.244.1.19 → 10.102.252.130 HTTP 305 GET /tools.descartes.teastore.registry/rest/services/tools.descartes.teastore.persistence/ HTTP/1.1 
    5 2024-05-10 11:04:16.435515 10.102.252.130 → 10.244.1.19  HTTP 266 HTTP/1.1 200   (application/json)
    6 2024-05-10 11:04:16.476299  10.244.1.19 → 10.102.252.130 TCP 68 38312 → 8080 [ACK] Seq=475 Ack=397 Win=501 Len=0 TSval=3881993893 TSecr=2075106188
    7 2024-05-10 11:04:17.931072  10.244.1.19 → 10.102.252.130 HTTP 366 PUT /tools.descartes.teastore.registry/rest/services/tools.descartes.teastore.recommender/10.244.1.19:8080 HTTP/1.1 
    8 2024-05-10 11:04:17.931551 10.102.252.130 → 10.244.1.19  HTTP 213 HTTP/1.1 200  
    9 2024-05-10 11:04:17.931557  10.244.1.19 → 10.102.252.130 TCP 68 38312 → 8080 [ACK] Seq=773 Ack=542 Win=501 Len=0 TSval=3881995348 TSecr=2075107684
   10 2024-05-10 11:04:18.931787  10.244.1.19 → 10.102.252.130 HTTP 305 GET /tools.descartes.teastore.registry/rest/services/tools.descartes.teastore.recommender/ HTTP/1.1 
   11 2024-05-10 11:04:18.932257 10.102.252.130 → 10.244.1.19  HTTP 266 HTTP/1.1 200   (application/json)
   12 2024-05-10 11:04:18.932263  10.244.1.19 → 10.102.252.130 TCP 68 38312 → 8080 [ACK] Seq=1010 Ack=740 Win=501 Len=0 TSval=3881996349 TSecr=2075108684
   13 2024-05-10 11:04:18.934749  10.244.1.19 → 10.102.252.130 HTTP 305 GET /tools.descartes.teastore.registry/rest/services/tools.descartes.teastore.persistence/ HTTP/1.1 
   14 2024-05-10 11:04:18.935126 10.102.252.130 → 10.244.1.19  HTTP 266 HTTP/1.1 200   (application/json)
   15 2024-05-10 11:04:18.980489  10.244.1.19 → 10.102.252.130 TCP 68 38312 → 8080 [ACK] Seq=1247 Ack=938 Win=501 Len=0 TSval=3881996397 TSecr=2075108687
   16 2024-05-10 11:04:20.431527  10.244.1.19 → 10.102.252.130 HTTP 366 PUT /tools.descartes.teastore.registry/rest/services/tools.descartes.teastore.recommender/10.244.1.19:8080 HTTP/1.1 
   17 2024-05-10 11:04:20.432000 10.102.252.130 → 10.244.1.19  HTTP 213 HTTP/1.1 200  
   18 2024-05-10 11:04:20.432006  10.244.1.19 → 10.102.252.130 TCP 68 38312 → 8080 [ACK] Seq=1545 Ack=1083 Win=501 Len=0 TSval=3881997848 TSecr=2075110184
   19 2024-05-10 11:04:21.432542  10.244.1.19 → 10.102.252.130 HTTP 305 GET /tools.descartes.teastore.registry/rest/services/tools.descartes.teastore.recommender/ HTTP/1.1 
   20 2024-05-10 11:04:21.433002 10.102.252.130 → 10.244.1.19  HTTP 266 HTTP/1.1 200   (application/json)
   21 2024-05-10 11:04:21.433008  10.244.1.19 → 10.102.252.130 TCP 68 38312 → 8080 [ACK] Seq=1782 Ack=1281 Win=501 Len=0 TSval=3881998849 TSecr=2075111185
   22 2024-05-10 11:04:21.435681  10.244.1.19 → 10.102.252.130 HTTP 305 GET /tools.descartes.teastore.registry/rest/services/tools.descartes.teastore.persistence/ HTTP/1.1 
   23 2024-05-10 11:04:21.436117 10.102.252.130 → 10.244.1.19  HTTP 266 HTTP/1.1 200   (application/json)
   24 2024-05-10 11:04:21.476821  10.244.1.19 → 10.102.252.130 TCP 68 38312 → 8080 [ACK] Seq=2019 Ack=1479 Win=501 Len=0 TSval=3881998893 TSecr=2075111188
   25 2024-05-10 11:04:22.932225  10.244.1.19 → 10.102.252.130 HTTP 366 PUT /tools.descartes.teastore.registry/rest/services/tools.descartes.teastore.recommender/10.244.1.19:8080 HTTP/1.1 
   26 2024-05-10 11:04:22.932720 10.102.252.130 → 10.244.1.19  HTTP 213 HTTP/1.1 200  
   27 2024-05-10 11:04:22.932727  10.244.1.19 → 10.102.252.130 TCP 68 38312 → 8080 [ACK] Seq=2317 Ack=1624 Win=501 Len=0 TSval=3882000349 TSecr=2075112685
   28 2024-05-10 11:04:23.935418  10.244.1.19 → 10.102.252.130 HTTP 305 GET /tools.descartes.teastore.registry/rest/services/tools.descartes.teastore.recommender/ HTTP/1.1 
   29 2024-05-10 11:04:23.935933 10.102.252.130 → 10.244.1.19  HTTP 266 HTTP/1.1 200   (application/json)
   30 2024-05-10 11:04:23.935940  10.244.1.19 → 10.102.252.130 TCP 68 38312 → 8080 [ACK] Seq=2554 Ack=1822 Win=501 Len=0 TSval=3882001352 TSecr=2075113688
   31 2024-05-10 11:04:23.938692  10.244.1.19 → 10.102.252.130 HTTP 305 GET /tools.descartes.teastore.registry/rest/services/tools.descartes.teastore.persistence/ HTTP/1.1 
   32 2024-05-10 11:04:23.939152 10.102.252.130 → 10.244.1.19  HTTP 266 HTTP/1.1 200   (application/json)
   33 2024-05-10 11:04:23.980843  10.244.1.19 → 10.102.252.130 TCP 68 38312 → 8080 [ACK] Seq=2791 Ack=2020 Win=501 Len=0 TSval=3882001397 TSecr=2075113691
   34 2024-05-10 11:04:24.108426  10.244.3.41 → 10.244.1.19  HTTP 313 GET /metrics HTTP/1.1 
   35 2024-05-10 11:04:24.108994  10.244.1.19 → 10.244.3.41  HTTP 910 HTTP/1.1 404   (text/html)
   36 2024-05-10 11:04:24.109256  10.244.3.41 → 10.244.1.19  TCP 68 44752 → 8080 [ACK] Seq=246 Ack=843 Win=501 Len=0 TSval=3923514651 TSecr=3688389344
   37 2024-05-10 11:04:25.445380  10.244.1.19 → 10.102.252.130 HTTP 366 PUT /tools.descartes.teastore.registry/rest/services/tools.descartes.teastore.recommender/10.244.1.19:8080 HTTP/1.1 
   38 2024-05-10 11:04:25.445829 10.102.252.130 → 10.244.1.19  HTTP 213 HTTP/1.1 200  
   39 2024-05-10 11:04:25.445835  10.244.1.19 → 10.102.252.130 TCP 68 38312 → 8080 [ACK] Seq=3089 Ack=2165 Win=501 Len=0 TSval=3882002862 TSecr=2075115198
   40 2024-05-10 11:04:26.431801  10.244.1.19 → 10.102.252.130 HTTP 305 GET /tools.descartes.teastore.registry/rest/services/tools.descartes.teastore.recommender/ HTTP/1.1 
   41 2024-05-10 11:04:26.432352 10.102.252.130 → 10.244.1.19  HTTP 266 HTTP/1.1 200   (application/json)
   42 2024-05-10 11:04:26.432358  10.244.1.19 → 10.102.252.130 TCP 68 38312 → 8080 [ACK] Seq=3326 Ack=2363 Win=501 Len=0 TSval=3882003849 TSecr=2075116185
   43 2024-05-10 11:04:26.435365  10.244.1.19 → 10.102.252.130 HTTP 305 GET /tools.descartes.teastore.registry/rest/services/tools.descartes.teastore.persistence/ HTTP/1.1 
   44 2024-05-10 11:04:26.435765 10.102.252.130 → 10.244.1.19  HTTP 266 HTTP/1.1 200   (application/json)
   45 2024-05-10 11:04:26.476422  10.244.1.19 → 10.102.252.130 TCP 68 38312 → 8080 [ACK] Seq=3563 Ack=2561 Win=501 Len=0 TSval=3882003893 TSecr=2075116188
   46 2024-05-10 11:04:27.931788  10.244.1.19 → 10.102.252.130 HTTP 366 PUT /tools.descartes.teastore.registry/rest/services/tools.descartes.teastore.recommender/10.244.1.19:8080 HTTP/1.1 
   47 2024-05-10 11:04:27.932321 10.102.252.130 → 10.244.1.19  HTTP 213 HTTP/1.1 200  
   48 2024-05-10 11:04:27.932327  10.244.1.19 → 10.102.252.130 TCP 68 38312 → 8080 [ACK] Seq=3861 Ack=2706 Win=501 Len=0 TSval=3882005349 TSecr=2075117685
   49 2024-05-10 11:04:28.731530  10.244.1.18 → 10.244.1.19  TCP 76 34396 → 8080 [SYN] Seq=0 Win=64240 Len=0 MSS=1460 SACK_PERM=1 TSval=846422944 TSecr=0 WS=128
   50 2024-05-10 11:04:28.731539  10.244.1.19 → 10.244.1.18  TCP 76 8080 → 34396 [SYN, ACK] Seq=0 Ack=1 Win=65160 Len=0 MSS=1460 SACK_PERM=1 TSval=2734216296 TSecr=846422944 WS=128
   51 2024-05-10 11:04:28.731552  10.244.1.18 → 10.244.1.19  TCP 68 34396 → 8080 [ACK] Seq=1 Ack=1 Win=64256 Len=0 TSval=846422944 TSecr=2734216296
   52 2024-05-10 11:04:28.733997  10.244.1.18 → 10.244.1.19  TCP 510 POST /tools.descartes.teastore.recommender/rest/recommend HTTP/1.1  [TCP segment of a reassembled PDU]
   53 2024-05-10 11:04:28.734012  10.244.1.19 → 10.244.1.18  TCP 68 8080 → 34396 [ACK] Seq=1 Ack=443 Win=64768 Len=0 TSval=2734216298 TSecr=846422946
   54 2024-05-10 11:04:28.734146  10.244.1.18 → 10.244.1.19  HTTP 73 POST /tools.descartes.teastore.recommender/rest/recommend HTTP/1.1  (application/json)
   55 2024-05-10 11:04:28.734147  10.244.1.19 → 10.244.1.18  TCP 68 8080 → 34396 [ACK] Seq=1 Ack=448 Win=64768 Len=0 TSval=2734216298 TSecr=846422946
   56 2024-05-10 11:04:28.798867  10.244.1.19 → 10.244.1.18  HTTP 283 HTTP/1.1 200   (application/json)
   57 2024-05-10 11:04:28.798907  10.244.1.18 → 10.244.1.19  TCP 68 34396 → 8080 [ACK] Seq=448 Ack=216 Win=64128 Len=0 TSval=846423011 TSecr=2734216363
   58 2024-05-10 11:04:28.933795  10.244.1.19 → 10.102.252.130 HTTP 305 GET /tools.descartes.teastore.registry/rest/services/tools.descartes.teastore.recommender/ HTTP/1.1 
   59 2024-05-10 11:04:28.934332 10.102.252.130 → 10.244.1.19  HTTP 266 HTTP/1.1 200   (application/json)
   60 2024-05-10 11:04:28.934339  10.244.1.19 → 10.102.252.130 TCP 68 38312 → 8080 [ACK] Seq=4098 Ack=2904 Win=501 Len=0 TSval=3882006351 TSecr=2075118687
   61 2024-05-10 11:04:28.937735  10.244.1.19 → 10.102.252.130 HTTP 305 GET /tools.descartes.teastore.registry/rest/services/tools.descartes.teastore.persistence/ HTTP/1.1 
   62 2024-05-10 11:04:28.938841 10.102.252.130 → 10.244.1.19  HTTP 266 HTTP/1.1 200   (application/json)
   63 2024-05-10 11:04:28.980960  10.244.1.19 → 10.102.252.130 TCP 68 38312 → 8080 [ACK] Seq=4335 Ack=3102 Win=501 Len=0 TSval=3882006397 TSecr=2075118691
   64 2024-05-10 11:04:29.328957    127.0.0.1 → 127.0.0.1    UDP 289 53436 → 6831 Len=245
   65 2024-05-10 11:04:29.328969    127.0.0.1 → 127.0.0.1    ICMP 317 Destination unreachable (Port unreachable)
   66 2024-05-10 11:04:29.395912  10.244.1.18 → 10.244.1.19  TCP 513 POST /tools.descartes.teastore.recommender/rest/recommend HTTP/1.1  [TCP segment of a reassembled PDU]
   67 2024-05-10 11:04:29.395941  10.244.1.19 → 10.244.1.18  TCP 68 8080 → 34396 [ACK] Seq=216 Ack=893 Win=64384 Len=0 TSval=2734216960 TSecr=846423608
   68 2024-05-10 11:04:29.396155  10.244.1.18 → 10.244.1.19  HTTP 73 POST /tools.descartes.teastore.recommender/rest/recommend HTTP/1.1  (application/json)
   69 2024-05-10 11:04:29.396158  10.244.1.19 → 10.244.1.18  TCP 68 8080 → 34396 [ACK] Seq=216 Ack=898 Win=64384 Len=0 TSval=2734216960 TSecr=846423608
   70 2024-05-10 11:04:29.399199  10.244.1.19 → 10.244.1.18  HTTP 283 HTTP/1.1 200   (application/json)
   71 2024-05-10 11:04:29.399248  10.244.1.18 → 10.244.1.19  TCP 68 34396 → 8080 [ACK] Seq=898 Ack=431 Win=64128 Len=0 TSval=846423611 TSecr=2734216963
   72 2024-05-10 11:04:30.078346  10.244.1.18 → 10.244.1.19  TCP 510 POST /tools.descartes.teastore.recommender/rest/recommend HTTP/1.1  [TCP segment of a reassembled PDU]
   73 2024-05-10 11:04:30.078505  10.244.1.18 → 10.244.1.19  HTTP 73 POST /tools.descartes.teastore.recommender/rest/recommend HTTP/1.1  (application/json)
   74 2024-05-10 11:04:30.078582  10.244.1.19 → 10.244.1.18  TCP 68 8080 → 34396 [ACK] Seq=431 Ack=1345 Win=64128 Len=0 TSval=2734217643 TSecr=846424291
   75 2024-05-10 11:04:30.080756  10.244.1.19 → 10.244.1.18  HTTP 283 HTTP/1.1 200   (application/json)
   76 2024-05-10 11:04:30.080804  10.244.1.18 → 10.244.1.19  TCP 68 34396 → 8080 [ACK] Seq=1345 Ack=646 Win=64128 Len=0 TSval=846424293 TSecr=2734217645
   77 2024-05-10 11:04:30.178911  10.244.1.18 → 10.244.1.19  TCP 514 POST /tools.descartes.teastore.recommender/rest/recommend HTTP/1.1  [TCP segment of a reassembled PDU]
   78 2024-05-10 11:04:30.179113  10.244.1.18 → 10.244.1.19  HTTP 73 POST /tools.descartes.teastore.recommender/rest/recommend HTTP/1.1  (application/json)
   79 2024-05-10 11:04:30.179211  10.244.1.19 → 10.244.1.18  TCP 68 8080 → 34396 [ACK] Seq=646 Ack=1796 Win=64128 Len=0 TSval=2734217743 TSecr=846424391
   80 2024-05-10 11:04:30.181753  10.244.1.19 → 10.244.1.18  HTTP 283 HTTP/1.1 200   (application/json)
   81 2024-05-10 11:04:30.181794  10.244.1.18 → 10.244.1.19  TCP 68 34396 → 8080 [ACK] Seq=1796 Ack=861 Win=64128 Len=0 TSval=846424394 TSecr=2734217746
   82 2024-05-10 11:04:30.300860  10.244.1.18 → 10.244.1.19  TCP 585 POST /tools.descartes.teastore.recommender/rest/recommend HTTP/1.1  [TCP segment of a reassembled PDU]
   83 2024-05-10 11:04:30.301101  10.244.1.18 → 10.244.1.19  HTTP 73 POST /tools.descartes.teastore.recommender/rest/recommend HTTP/1.1  (application/json)
   84 2024-05-10 11:04:30.301401  10.244.1.19 → 10.244.1.18  TCP 68 8080 → 34396 [ACK] Seq=861 Ack=2318 Win=64128 Len=0 TSval=2734217866 TSecr=846424513
   85 2024-05-10 11:04:30.303763  10.244.1.19 → 10.244.1.18  HTTP 283 HTTP/1.1 200   (application/json)
   86 2024-05-10 11:04:30.303813  10.244.1.18 → 10.244.1.19  TCP 68 34396 → 8080 [ACK] Seq=2318 Ack=1076 Win=64128 Len=0 TSval=846424516 TSecr=2734217868
   87 2024-05-10 11:04:30.405102  10.244.1.18 → 10.244.1.19  TCP 587 POST /tools.descartes.teastore.recommender/rest/recommend HTTP/1.1  [TCP segment of a reassembled PDU]
   88 2024-05-10 11:04:30.405229  10.244.1.18 → 10.244.1.19  HTTP 73 POST /tools.descartes.teastore.recommender/rest/recommend HTTP/1.1  (application/json)
   89 2024-05-10 11:04:30.405341  10.244.1.19 → 10.244.1.18  TCP 68 8080 → 34396 [ACK] Seq=1076 Ack=2842 Win=64128 Len=0 TSval=2734217970 TSecr=846424617
   90 2024-05-10 11:04:30.407243  10.244.1.19 → 10.244.1.18  HTTP 283 HTTP/1.1 200   (application/json)
   91 2024-05-10 11:04:30.407286  10.244.1.18 → 10.244.1.19  TCP 68 34396 → 8080 [ACK] Seq=2842 Ack=1291 Win=64128 Len=0 TSval=846424620 TSecr=2734217971
   92 2024-05-10 11:04:30.433292  10.244.1.19 → 10.102.252.130 HTTP 366 PUT /tools.descartes.teastore.registry/rest/services/tools.descartes.teastore.recommender/10.244.1.19:8080 HTTP/1.1 
   93 2024-05-10 11:04:30.433910 10.102.252.130 → 10.244.1.19  HTTP 213 HTTP/1.1 200  
   94 2024-05-10 11:04:30.433915  10.244.1.19 → 10.102.252.130 TCP 68 38312 → 8080 [ACK] Seq=4633 Ack=3247 Win=501 Len=0 TSval=3882007850 TSecr=2075120186
   95 2024-05-10 11:04:30.574312  10.244.1.18 → 10.244.1.19  TCP 658 POST /tools.descartes.teastore.recommender/rest/recommend HTTP/1.1  [TCP segment of a reassembled PDU]
   96 2024-05-10 11:04:30.574398  10.244.1.18 → 10.244.1.19  HTTP 73 POST /tools.descartes.teastore.recommender/rest/recommend HTTP/1.1  (application/json)
   97 2024-05-10 11:04:30.574401  10.244.1.19 → 10.244.1.18  TCP 68 8080 → 34396 [ACK] Seq=1291 Ack=3437 Win=64128 Len=0 TSval=2734218139 TSecr=846424787
   98 2024-05-10 11:04:30.576275  10.244.1.19 → 10.244.1.18  HTTP 283 HTTP/1.1 200   (application/json)
   99 2024-05-10 11:04:30.576310  10.244.1.18 → 10.244.1.19  TCP 68 34396 → 8080 [ACK] Seq=3437 Ack=1506 Win=64128 Len=0 TSval=846424789 TSecr=2734218141
  100 2024-05-10 11:04:30.656681  10.244.1.18 → 10.244.1.19  TCP 662 POST /tools.descartes.teastore.recommender/rest/recommend HTTP/1.1  [TCP segment of a reassembled PDU]
  101 2024-05-10 11:04:30.656825  10.244.1.18 → 10.244.1.19  HTTP 73 POST /tools.descartes.teastore.recommender/rest/recommend HTTP/1.1  (application/json)
  102 2024-05-10 11:04:30.656828  10.244.1.19 → 10.244.1.18  TCP 68 8080 → 34396 [ACK] Seq=1506 Ack=4036 Win=64128 Len=0 TSval=2734218221 TSecr=846424869
  103 2024-05-10 11:04:30.658610  10.244.1.19 → 10.244.1.18  HTTP 283 HTTP/1.1 200   (application/json)
  104 2024-05-10 11:04:30.658652  10.244.1.18 → 10.244.1.19  TCP 68 34396 → 8080 [ACK] Seq=4036 Ack=1721 Win=64128 Len=0 TSval=846424871 TSecr=2734218223
  105 2024-05-10 11:04:31.326721    127.0.0.1 → 127.0.0.1    UDP 450 53436 → 6831 Len=406
  106 2024-05-10 11:04:31.326738    127.0.0.1 → 127.0.0.1    ICMP 478 Destination unreachable (Port unreachable)
  107 2024-05-10 11:04:31.347863  10.244.1.18 → 10.244.1.19  TCP 510 POST /tools.descartes.teastore.recommender/rest/recommend HTTP/1.1  [TCP segment of a reassembled PDU]
  108 2024-05-10 11:04:31.347988  10.244.1.18 → 10.244.1.19  HTTP 73 POST /tools.descartes.teastore.recommender/rest/recommend HTTP/1.1  (application/json)
  109 2024-05-10 11:04:31.348069  10.244.1.19 → 10.244.1.18  TCP 68 8080 → 34396 [ACK] Seq=1721 Ack=4483 Win=64128 Len=0 TSval=2734218912 TSecr=846425560
  110 2024-05-10 11:04:31.349778  10.244.1.19 → 10.244.1.18  HTTP 283 HTTP/1.1 200   (application/json)
  111 2024-05-10 11:04:31.349803  10.244.1.18 → 10.244.1.19  TCP 68 34396 → 8080 [ACK] Seq=4483 Ack=1936 Win=64128 Len=0 TSval=846425562 TSecr=2734218914
  112 2024-05-10 11:04:31.430692  10.244.1.18 → 10.244.1.19  TCP 513 POST /tools.descartes.teastore.recommender/rest/recommend HTTP/1.1  [TCP segment of a reassembled PDU]
  113 2024-05-10 11:04:31.430816  10.244.1.18 → 10.244.1.19  HTTP 73 POST /tools.descartes.teastore.recommender/rest/recommend HTTP/1.1  (application/json)
  114 2024-05-10 11:04:31.430915  10.244.1.19 → 10.244.1.18  TCP 68 8080 → 34396 [ACK] Seq=1936 Ack=4933 Win=64128 Len=0 TSval=2734218995 TSecr=846425643
  115 2024-05-10 11:04:31.433077  10.244.1.19 → 10.102.252.130 HTTP 305 GET /tools.descartes.teastore.registry/rest/services/tools.descartes.teastore.recommender/ HTTP/1.1 
  116 2024-05-10 11:04:31.433590 10.102.252.130 → 10.244.1.19  HTTP 266 HTTP/1.1 200   (application/json)
  117 2024-05-10 11:04:31.433597  10.244.1.19 → 10.102.252.130 TCP 68 38312 → 8080 [ACK] Seq=4870 Ack=3445 Win=501 Len=0 TSval=3882008850 TSecr=2075121186
  118 2024-05-10 11:04:31.433998  10.244.1.19 → 10.244.1.18  HTTP 283 HTTP/1.1 200   (application/json)
  119 2024-05-10 11:04:31.434030  10.244.1.18 → 10.244.1.19  TCP 68 34396 → 8080 [ACK] Seq=4933 Ack=2151 Win=64128 Len=0 TSval=846425646 TSecr=2734218998
  120 2024-05-10 11:04:31.437753  10.244.1.19 → 10.102.252.130 HTTP 305 GET /tools.descartes.teastore.registry/rest/services/tools.descartes.teastore.persistence/ HTTP/1.1 
  121 2024-05-10 11:04:31.438371 10.102.252.130 → 10.244.1.19  HTTP 266 HTTP/1.1 200   (application/json)
  122 2024-05-10 11:04:31.480507  10.244.1.19 → 10.102.252.130 TCP 68 38312 → 8080 [ACK] Seq=5107 Ack=3643 Win=501 Len=0 TSval=3882008897 TSecr=2075121191
  123 2024-05-10 11:04:31.564879  10.244.1.18 → 10.244.1.19  TCP 584 POST /tools.descartes.teastore.recommender/rest/recommend HTTP/1.1  [TCP segment of a reassembled PDU]
  124 2024-05-10 11:04:31.565023  10.244.1.18 → 10.244.1.19  HTTP 73 POST /tools.descartes.teastore.recommender/rest/recommend HTTP/1.1  (application/json)
  125 2024-05-10 11:04:31.565294  10.244.1.19 → 10.244.1.18  TCP 68 8080 → 34396 [ACK] Seq=2151 Ack=5454 Win=64128 Len=0 TSval=2734219130 TSecr=846425777
  126 2024-05-10 11:04:31.566931  10.244.1.19 → 10.244.1.18  HTTP 283 HTTP/1.1 200   (application/json)
  127 2024-05-10 11:04:31.566972  10.244.1.18 → 10.244.1.19  TCP 68 34396 → 8080 [ACK] Seq=5454 Ack=2366 Win=64128 Len=0 TSval=846425779 TSecr=2734219131
  128 2024-05-10 11:04:31.650674  10.244.1.18 → 10.244.1.19  TCP 587 POST /tools.descartes.teastore.recommender/rest/recommend HTTP/1.1  [TCP segment of a reassembled PDU]
  129 2024-05-10 11:04:31.650767  10.244.1.18 → 10.244.1.19  HTTP 73 POST /tools.descartes.teastore.recommender/rest/recommend HTTP/1.1  (application/json)
  130 2024-05-10 11:04:31.650924  10.244.1.19 → 10.244.1.18  TCP 68 8080 → 34396 [ACK] Seq=2366 Ack=5978 Win=64128 Len=0 TSval=2734219215 TSecr=846425863
  131 2024-05-10 11:04:31.653209  10.244.1.19 → 10.244.1.18  HTTP 283 HTTP/1.1 200   (application/json)
  132 2024-05-10 11:04:31.653238  10.244.1.18 → 10.244.1.19  TCP 68 34396 → 8080 [ACK] Seq=5978 Ack=2581 Win=64128 Len=0 TSval=846425865 TSecr=2734219217
  133 2024-05-10 11:04:31.924475  10.244.1.18 → 10.244.1.19  TCP 510 POST /tools.descartes.teastore.recommender/rest/recommend HTTP/1.1  [TCP segment of a reassembled PDU]
  134 2024-05-10 11:04:31.926500  10.244.1.19 → 10.244.1.18  HTTP 283 HTTP/1.1 200   (application/json)
  135 2024-05-10 11:04:31.926548  10.244.1.18 → 10.244.1.19  TCP 68 34396 → 8080 [ACK] Seq=6420 Ack=2796 Win=64128 Len=0 TSval=846426139 TSecr=2734219491
  136 2024-05-10 11:04:31.926865  10.244.1.18 → 10.244.1.19  HTTP 73 POST /tools.descartes.teastore.recommender/rest/recommend HTTP/1.1  (application/json)
  137 2024-05-10 11:04:31.972274  10.244.1.19 → 10.244.1.18  TCP 68 8080 → 34396 [ACK] Seq=2796 Ack=6425 Win=64128 Len=0 TSval=2734219537 TSecr=846426139
  138 2024-05-10 11:04:32.007918  10.244.1.18 → 10.244.1.19  TCP 513 POST /tools.descartes.teastore.recommender/rest/recommend HTTP/1.1  [TCP segment of a reassembled PDU]
  139 2024-05-10 11:04:32.007922  10.244.1.19 → 10.244.1.18  TCP 68 8080 → 34396 [ACK] Seq=2796 Ack=6870 Win=64128 Len=0 TSval=2734219572 TSecr=846426220
  140 2024-05-10 11:04:32.008026  10.244.1.18 → 10.244.1.19  HTTP 73 POST /tools.descartes.teastore.recommender/rest/recommend HTTP/1.1  (application/json)
  141 2024-05-10 11:04:32.008027  10.244.1.19 → 10.244.1.18  TCP 68 8080 → 34396 [ACK] Seq=2796 Ack=6875 Win=64128 Len=0 TSval=2734219572 TSecr=846426220
  142 2024-05-10 11:04:32.009967  10.244.1.19 → 10.244.1.18  HTTP 283 HTTP/1.1 200   (application/json)
  143 2024-05-10 11:04:32.052399  10.244.1.18 → 10.244.1.19  TCP 68 34396 → 8080 [ACK] Seq=6875 Ack=3011 Win=64128 Len=0 TSval=846426265 TSecr=2734219574
  144 2024-05-10 11:04:32.239365  10.244.1.18 → 10.244.1.19  TCP 510 POST /tools.descartes.teastore.recommender/rest/recommend HTTP/1.1  [TCP segment of a reassembled PDU]
  145 2024-05-10 11:04:32.239481  10.244.1.18 → 10.244.1.19  HTTP 73 POST /tools.descartes.teastore.recommender/rest/recommend HTTP/1.1  (application/json)
  146 2024-05-10 11:04:32.242145  10.244.1.19 → 10.244.1.18  TCP 68 8080 → 34396 [ACK] Seq=3011 Ack=7322 Win=64128 Len=0 TSval=2734219806 TSecr=846426452
  147 2024-05-10 11:04:32.245485  10.244.1.19 → 10.244.1.18  HTTP 283 HTTP/1.1 200   (application/json)
  148 2024-05-10 11:04:32.245546  10.244.1.18 → 10.244.1.19  TCP 68 34396 → 8080 [ACK] Seq=7322 Ack=3226 Win=64128 Len=0 TSval=846426458 TSecr=2734219810
  149 2024-05-10 11:04:32.337967  10.244.1.18 → 10.244.1.19  TCP 513 POST /tools.descartes.teastore.recommender/rest/recommend HTTP/1.1  [TCP segment of a reassembled PDU]
  150 2024-05-10 11:04:32.338129  10.244.1.18 → 10.244.1.19  HTTP 73 POST /tools.descartes.teastore.recommender/rest/recommend HTTP/1.1  (application/json)
  151 2024-05-10 11:04:32.338411  10.244.1.19 → 10.244.1.18  TCP 68 8080 → 34396 [ACK] Seq=3226 Ack=7772 Win=64128 Len=0 TSval=2734219903 TSecr=846426550
  152 2024-05-10 11:04:32.341397  10.244.1.19 → 10.244.1.18  HTTP 283 HTTP/1.1 200   (application/json)
  153 2024-05-10 11:04:32.341486  10.244.1.18 → 10.244.1.19  TCP 68 34396 → 8080 [ACK] Seq=7772 Ack=3441 Win=64128 Len=0 TSval=846426554 TSecr=2734219906
  154 2024-05-10 11:04:32.498761  10.244.1.18 → 10.244.1.19  TCP 584 POST /tools.descartes.teastore.recommender/rest/recommend HTTP/1.1  [TCP segment of a reassembled PDU]
  155 2024-05-10 11:04:32.498907  10.244.1.18 → 10.244.1.19  HTTP 73 POST /tools.descartes.teastore.recommender/rest/recommend HTTP/1.1  (application/json)
  156 2024-05-10 11:04:32.499231  10.244.1.19 → 10.244.1.18  TCP 68 8080 → 34396 [ACK] Seq=3441 Ack=8293 Win=64128 Len=0 TSval=2734220063 TSecr=846426711
  157 2024-05-10 11:04:32.501690  10.244.1.19 → 10.244.1.18  HTTP 283 HTTP/1.1 200   (application/json)
  158 2024-05-10 11:04:32.501757  10.244.1.18 → 10.244.1.19  TCP 68 34396 → 8080 [ACK] Seq=8293 Ack=3656 Win=64128 Len=0 TSval=846426714 TSecr=2734220066
  159 2024-05-10 11:04:32.591150  10.244.1.18 → 10.244.1.19  TCP 586 POST /tools.descartes.teastore.recommender/rest/recommend HTTP/1.1  [TCP segment of a reassembled PDU]
  160 2024-05-10 11:04:32.591369  10.244.1.18 → 10.244.1.19  HTTP 73 POST /tools.descartes.teastore.recommender/rest/recommend HTTP/1.1  (application/json)
  161 2024-05-10 11:04:32.591431  10.244.1.19 → 10.244.1.18  TCP 68 8080 → 34396 [ACK] Seq=3656 Ack=8816 Win=64128 Len=0 TSval=2734220156 TSecr=846426803
  162 2024-05-10 11:04:32.593456  10.244.1.19 → 10.244.1.18  HTTP 283 HTTP/1.1 200   (application/json)
  163 2024-05-10 11:04:32.593506  10.244.1.18 → 10.244.1.19  TCP 68 34396 → 8080 [ACK] Seq=8816 Ack=3871 Win=64128 Len=0 TSval=846426806 TSecr=2734220158
  164 2024-05-10 11:04:32.849962  10.244.1.18 → 10.244.1.19  TCP 510 POST /tools.descartes.teastore.recommender/rest/recommend HTTP/1.1  [TCP segment of a reassembled PDU]
  165 2024-05-10 11:04:32.850142  10.244.1.18 → 10.244.1.19  HTTP 73 POST /tools.descartes.teastore.recommender/rest/recommend HTTP/1.1  (application/json)
  166 2024-05-10 11:04:32.851498  10.244.1.19 → 10.244.1.18  TCP 68 8080 → 34396 [ACK] Seq=3871 Ack=9263 Win=64128 Len=0 TSval=2734220416 TSecr=846427062
  167 2024-05-10 11:04:32.853540  10.244.1.19 → 10.244.1.18  HTTP 283 HTTP/1.1 200   (application/json)
  168 2024-05-10 11:04:32.853597  10.244.1.18 → 10.244.1.19  TCP 68 34396 → 8080 [ACK] Seq=9263 Ack=4086 Win=64128 Len=0 TSval=846427066 TSecr=2734220418
  169 2024-05-10 11:04:32.927249  10.244.1.18 → 10.244.1.19  TCP 514 POST /tools.descartes.teastore.recommender/rest/recommend HTTP/1.1  [TCP segment of a reassembled PDU]
  170 2024-05-10 11:04:32.927322  10.244.1.18 → 10.244.1.19  HTTP 73 POST /tools.descartes.teastore.recommender/rest/recommend HTTP/1.1  (application/json)
  171 2024-05-10 11:04:32.928603  10.244.1.19 → 10.244.1.18  TCP 68 8080 → 34396 [ACK] Seq=4086 Ack=9714 Win=64128 Len=0 TSval=2734220493 TSecr=846427139
  172 2024-05-10 11:04:32.930368  10.244.1.19 → 10.244.1.18  HTTP 283 HTTP/1.1 200   (application/json)
  173 2024-05-10 11:04:32.930411  10.244.1.18 → 10.244.1.19  TCP 68 34396 → 8080 [ACK] Seq=9714 Ack=4301 Win=64128 Len=0 TSval=846427143 TSecr=2734220495
  174 2024-05-10 11:04:32.947618  10.244.1.19 → 10.102.252.130 HTTP 366 PUT /tools.descartes.teastore.registry/rest/services/tools.descartes.teastore.recommender/10.244.1.19:8080 HTTP/1.1 
  175 2024-05-10 11:04:32.948338 10.102.252.130 → 10.244.1.19  HTTP 213 HTTP/1.1 200  
  176 2024-05-10 11:04:32.948346  10.244.1.19 → 10.102.252.130 TCP 68 38312 → 8080 [ACK] Seq=5405 Ack=3788 Win=501 Len=0 TSval=3882010365 TSecr=2075122701
  177 2024-05-10 11:04:33.016987  10.244.1.18 → 10.244.1.19  TCP 585 POST /tools.descartes.teastore.recommender/rest/recommend HTTP/1.1  [TCP segment of a reassembled PDU]
  178 2024-05-10 11:04:33.017113  10.244.1.18 → 10.244.1.19  HTTP 73 POST /tools.descartes.teastore.recommender/rest/recommend HTTP/1.1  (application/json)
  179 2024-05-10 11:04:33.017263  10.244.1.19 → 10.244.1.18  TCP 68 8080 → 34396 [ACK] Seq=4301 Ack=10236 Win=64128 Len=0 TSval=2734220582 TSecr=846427229
  180 2024-05-10 11:04:33.018832  10.244.1.19 → 10.244.1.18  HTTP 283 HTTP/1.1 200   (application/json)
  181 2024-05-10 11:04:33.018863  10.244.1.18 → 10.244.1.19  TCP 68 34396 → 8080 [ACK] Seq=10236 Ack=4516 Win=64128 Len=0 TSval=846427231 TSecr=2734220583
  182 2024-05-10 11:04:33.090488  10.244.1.18 → 10.244.1.19  TCP 588 POST /tools.descartes.teastore.recommender/rest/recommend HTTP/1.1  [TCP segment of a reassembled PDU]
  183 2024-05-10 11:04:33.090566  10.244.1.18 → 10.244.1.19  HTTP 73 POST /tools.descartes.teastore.recommender/rest/recommend HTTP/1.1  (application/json)
  184 2024-05-10 11:04:33.090713  10.244.1.19 → 10.244.1.18  TCP 68 8080 → 34396 [ACK] Seq=4516 Ack=10761 Win=64128 Len=0 TSval=2734220655 TSecr=846427303
  185 2024-05-10 11:04:33.092218  10.244.1.19 → 10.244.1.18  HTTP 283 HTTP/1.1 200   (application/json)
  186 2024-05-10 11:04:33.092274  10.244.1.18 → 10.244.1.19  TCP 68 34396 → 8080 [ACK] Seq=10761 Ack=4731 Win=64128 Len=0 TSval=846427305 TSecr=2734220656
  187 2024-05-10 11:04:33.327245    127.0.0.1 → 127.0.0.1    UDP 769 53436 → 6831 Len=725
  188 2024-05-10 11:04:33.327261    127.0.0.1 → 127.0.0.1    ICMP 592 Destination unreachable (Port unreachable)
  189 2024-05-10 11:04:33.330573  10.244.1.18 → 10.244.1.19  TCP 510 POST /tools.descartes.teastore.recommender/rest/recommend HTTP/1.1  [TCP segment of a reassembled PDU]
  190 2024-05-10 11:04:33.330704  10.244.1.18 → 10.244.1.19  HTTP 73 POST /tools.descartes.teastore.recommender/rest/recommend HTTP/1.1  (application/json)
  191 2024-05-10 11:04:33.330848  10.244.1.19 → 10.244.1.18  TCP 68 8080 → 34396 [ACK] Seq=4731 Ack=11208 Win=64128 Len=0 TSval=2734220895 TSecr=846427543
  192 2024-05-10 11:04:33.332674  10.244.1.19 → 10.244.1.18  HTTP 283 HTTP/1.1 200   (application/json)
  193 2024-05-10 11:04:33.332731  10.244.1.18 → 10.244.1.19  TCP 68 34396 → 8080 [ACK] Seq=11208 Ack=4946 Win=64128 Len=0 TSval=846427545 TSecr=2734220897
  194 2024-05-10 11:04:33.412006  10.244.1.18 → 10.244.1.19  TCP 514 POST /tools.descartes.teastore.recommender/rest/recommend HTTP/1.1  [TCP segment of a reassembled PDU]
  195 2024-05-10 11:04:33.412100  10.244.1.18 → 10.244.1.19  HTTP 73 POST /tools.descartes.teastore.recommender/rest/recommend HTTP/1.1  (application/json)
  196 2024-05-10 11:04:33.412236  10.244.1.19 → 10.244.1.18  TCP 68 8080 → 34396 [ACK] Seq=4946 Ack=11659 Win=64128 Len=0 TSval=2734220976 TSecr=846427624
  197 2024-05-10 11:04:33.414453  10.244.1.19 → 10.244.1.18  HTTP 283 HTTP/1.1 200   (application/json)
  198 2024-05-10 11:04:33.414503  10.244.1.18 → 10.244.1.19  TCP 68 34396 → 8080 [ACK] Seq=11659 Ack=5161 Win=64128 Len=0 TSval=846427627 TSecr=2734220979
  199 2024-05-10 11:04:33.535229  10.244.1.18 → 10.244.1.19  TCP 585 POST /tools.descartes.teastore.recommender/rest/recommend HTTP/1.1  [TCP segment of a reassembled PDU]
  200 2024-05-10 11:04:33.535414  10.244.1.18 → 10.244.1.19  HTTP 73 POST /tools.descartes.teastore.recommender/rest/recommend HTTP/1.1  (application/json)
  201 2024-05-10 11:04:33.535483  10.244.1.19 → 10.244.1.18  TCP 68 8080 → 34396 [ACK] Seq=5161 Ack=12181 Win=64128 Len=0 TSval=2734221100 TSecr=846427747
  202 2024-05-10 11:04:33.537251  10.244.1.19 → 10.244.1.18  HTTP 283 HTTP/1.1 200   (application/json)
  203 2024-05-10 11:04:33.537298  10.244.1.18 → 10.244.1.19  TCP 68 34396 → 8080 [ACK] Seq=12181 Ack=5376 Win=64128 Len=0 TSval=846427750 TSecr=2734221102
  204 2024-05-10 11:04:33.611188  10.244.1.18 → 10.244.1.19  TCP 588 POST /tools.descartes.teastore.recommender/rest/recommend HTTP/1.1  [TCP segment of a reassembled PDU]
  205 2024-05-10 11:04:33.611267  10.244.1.18 → 10.244.1.19  HTTP 73 POST /tools.descartes.teastore.recommender/rest/recommend HTTP/1.1  (application/json)
  206 2024-05-10 11:04:33.611421  10.244.1.19 → 10.244.1.18  TCP 68 8080 → 34396 [ACK] Seq=5376 Ack=12706 Win=64128 Len=0 TSval=2734221176 TSecr=846427823
  207 2024-05-10 11:04:33.613593  10.244.1.19 → 10.244.1.18  HTTP 283 HTTP/1.1 200   (application/json)
  208 2024-05-10 11:04:33.613631  10.244.1.18 → 10.244.1.19  TCP 68 34396 → 8080 [ACK] Seq=12706 Ack=5591 Win=64128 Len=0 TSval=846427826 TSecr=2734221178
  209 2024-05-10 11:04:33.721468  10.244.1.18 → 10.244.1.19  TCP 659 POST /tools.descartes.teastore.recommender/rest/recommend HTTP/1.1  [TCP segment of a reassembled PDU]
  210 2024-05-10 11:04:33.721575  10.244.1.18 → 10.244.1.19  HTTP 73 POST /tools.descartes.teastore.recommender/rest/recommend HTTP/1.1  (application/json)
  211 2024-05-10 11:04:33.721579  10.244.1.19 → 10.244.1.18  TCP 68 8080 → 34396 [ACK] Seq=5591 Ack=13302 Win=64128 Len=0 TSval=2734221286 TSecr=846427934
  212 2024-05-10 11:04:33.723309  10.244.1.19 → 10.244.1.18  HTTP 283 HTTP/1.1 200   (application/json)
  213 2024-05-10 11:04:33.723350  10.244.1.18 → 10.244.1.19  TCP 68 34396 → 8080 [ACK] Seq=13302 Ack=5806 Win=64128 Len=0 TSval=846427936 TSecr=2734221288
  214 2024-05-10 11:04:33.790793  10.244.1.18 → 10.244.1.19  TCP 661 POST /tools.descartes.teastore.recommender/rest/recommend HTTP/1.1  [TCP segment of a reassembled PDU]
  215 2024-05-10 11:04:33.790859  10.244.1.18 → 10.244.1.19  HTTP 73 POST /tools.descartes.teastore.recommender/rest/recommend HTTP/1.1  (application/json)
  216 2024-05-10 11:04:33.790862  10.244.1.19 → 10.244.1.18  TCP 68 8080 → 34396 [ACK] Seq=5806 Ack=13900 Win=64128 Len=0 TSval=2734221355 TSecr=846428003
  217 2024-05-10 11:04:33.792719  10.244.1.19 → 10.244.1.18  HTTP 283 HTTP/1.1 200   (application/json)
  218 2024-05-10 11:04:33.792835  10.244.1.18 → 10.244.1.19  TCP 68 34396 → 8080 [ACK] Seq=13900 Ack=6021 Win=64128 Len=0 TSval=846428005 TSecr=2734221357
  219 2024-05-10 11:04:33.936172  10.244.1.19 → 10.102.252.130 HTTP 305 GET /tools.descartes.teastore.registry/rest/services/tools.descartes.teastore.recommender/ HTTP/1.1 
  220 2024-05-10 11:04:33.936761 10.102.252.130 → 10.244.1.19  HTTP 266 HTTP/1.1 200   (application/json)
  221 2024-05-10 11:04:33.936767  10.244.1.19 → 10.102.252.130 TCP 68 38312 → 8080 [ACK] Seq=5642 Ack=3986 Win=501 Len=0 TSval=3882011353 TSecr=2075123689
  222 2024-05-10 11:04:33.940779  10.244.1.19 → 10.102.252.130 HTTP 305 GET /tools.descartes.teastore.registry/rest/services/tools.descartes.teastore.persistence/ HTTP/1.1 
  223 2024-05-10 11:04:33.941709 10.102.252.130 → 10.244.1.19  HTTP 266 HTTP/1.1 200   (application/json)
  224 2024-05-10 11:04:33.984325  10.244.1.19 → 10.102.252.130 TCP 68 38312 → 8080 [ACK] Seq=5879 Ack=4184 Win=501 Len=0 TSval=3882011401 TSecr=2075123694
  225 2024-05-10 11:04:34.001454  10.244.1.18 → 10.244.1.19  TCP 510 POST /tools.descartes.teastore.recommender/rest/recommend HTTP/1.1  [TCP segment of a reassembled PDU]
  226 2024-05-10 11:04:34.001562  10.244.1.18 → 10.244.1.19  HTTP 73 POST /tools.descartes.teastore.recommender/rest/recommend HTTP/1.1  (application/json)
  227 2024-05-10 11:04:34.001665  10.244.1.19 → 10.244.1.18  TCP 68 8080 → 34396 [ACK] Seq=6021 Ack=14347 Win=64128 Len=0 TSval=2734221566 TSecr=846428214
  228 2024-05-10 11:04:34.003458  10.244.1.19 → 10.244.1.18  HTTP 283 HTTP/1.1 200   (application/json)
  229 2024-05-10 11:04:34.003507  10.244.1.18 → 10.244.1.19  TCP 68 34396 → 8080 [ACK] Seq=14347 Ack=6236 Win=64128 Len=0 TSval=846428216 TSecr=2734221568
  230 2024-05-10 11:04:34.074657  10.244.1.18 → 10.244.1.19  TCP 513 POST /tools.descartes.teastore.recommender/rest/recommend HTTP/1.1  [TCP segment of a reassembled PDU]
  231 2024-05-10 11:04:34.074733  10.244.1.18 → 10.244.1.19  HTTP 73 POST /tools.descartes.teastore.recommender/rest/recommend HTTP/1.1  (application/json)
  232 2024-05-10 11:04:34.074920  10.244.1.19 → 10.244.1.18  TCP 68 8080 → 34396 [ACK] Seq=6236 Ack=14797 Win=64128 Len=0 TSval=2734221639 TSecr=846428287
  233 2024-05-10 11:04:34.076631  10.244.1.19 → 10.244.1.18  HTTP 283 HTTP/1.1 200   (application/json)
  234 2024-05-10 11:04:34.076674  10.244.1.18 → 10.244.1.19  TCP 68 34396 → 8080 [ACK] Seq=14797 Ack=6451 Win=64128 Len=0 TSval=846428289 TSecr=2734221641
  235 2024-05-10 11:04:34.150832  10.244.1.18 → 10.244.1.19  TCP 584 POST /tools.descartes.teastore.recommender/rest/recommend HTTP/1.1  [TCP segment of a reassembled PDU]
  236 2024-05-10 11:04:34.150883  10.244.1.18 → 10.244.1.19  HTTP 73 POST /tools.descartes.teastore.recommender/rest/recommend HTTP/1.1  (application/json)
  237 2024-05-10 11:04:34.151047  10.244.1.19 → 10.244.1.18  TCP 68 8080 → 34396 [ACK] Seq=6451 Ack=15318 Win=64128 Len=0 TSval=2734221715 TSecr=846428363
  238 2024-05-10 11:04:34.152490  10.244.1.19 → 10.244.1.18  HTTP 283 HTTP/1.1 200   (application/json)
  239 2024-05-10 11:04:34.152530  10.244.1.18 → 10.244.1.19  TCP 68 34396 → 8080 [ACK] Seq=15318 Ack=6666 Win=64128 Len=0 TSval=846428365 TSecr=2734221717
  240 2024-05-10 11:04:34.222477  10.244.1.18 → 10.244.1.19  TCP 587 POST /tools.descartes.teastore.recommender/rest/recommend HTTP/1.1  [TCP segment of a reassembled PDU]
  241 2024-05-10 11:04:34.222619  10.244.1.18 → 10.244.1.19  HTTP 73 POST /tools.descartes.teastore.recommender/rest/recommend HTTP/1.1  (application/json)
  242 2024-05-10 11:04:34.222748  10.244.1.19 → 10.244.1.18  TCP 68 8080 → 34396 [ACK] Seq=6666 Ack=15842 Win=64128 Len=0 TSval=2734221787 TSecr=846428435
  243 2024-05-10 11:04:34.224567  10.244.1.19 → 10.244.1.18  HTTP 283 HTTP/1.1 200   (application/json)
  244 2024-05-10 11:04:34.224608  10.244.1.18 → 10.244.1.19  TCP 68 34396 → 8080 [ACK] Seq=15842 Ack=6881 Win=64128 Len=0 TSval=846428437 TSecr=2734221789
  245 2024-05-10 11:04:34.350248  10.244.1.18 → 10.244.1.19  TCP 658 POST /tools.descartes.teastore.recommender/rest/recommend HTTP/1.1  [TCP segment of a reassembled PDU]
  246 2024-05-10 11:04:34.350348  10.244.1.18 → 10.244.1.19  HTTP 73 POST /tools.descartes.teastore.recommender/rest/recommend HTTP/1.1  (application/json)
  247 2024-05-10 11:04:34.350353  10.244.1.19 → 10.244.1.18  TCP 68 8080 → 34396 [ACK] Seq=6881 Ack=16437 Win=64128 Len=0 TSval=2734221915 TSecr=846428562
  248 2024-05-10 11:04:34.352776  10.244.1.19 → 10.244.1.18  HTTP 283 HTTP/1.1 200   (application/json)
  249 2024-05-10 11:04:34.352837  10.244.1.18 → 10.244.1.19  TCP 68 34396 → 8080 [ACK] Seq=16437 Ack=7096 Win=64128 Len=0 TSval=846428565 TSecr=2734221917
  250 2024-05-10 11:04:34.435145  10.244.1.18 → 10.244.1.19  TCP 661 POST /tools.descartes.teastore.recommender/rest/recommend HTTP/1.1  [TCP segment of a reassembled PDU]
  251 2024-05-10 11:04:34.435226  10.244.1.18 → 10.244.1.19  HTTP 73 POST /tools.descartes.teastore.recommender/rest/recommend HTTP/1.1  (application/json)
  252 2024-05-10 11:04:34.435228  10.244.1.19 → 10.244.1.18  TCP 68 8080 → 34396 [ACK] Seq=7096 Ack=17035 Win=64128 Len=0 TSval=2734221999 TSecr=846428647
  253 2024-05-10 11:04:34.437667  10.244.1.19 → 10.244.1.18  HTTP 283 HTTP/1.1 200   (application/json)
  254 2024-05-10 11:04:34.437714  10.244.1.18 → 10.244.1.19  TCP 68 34396 → 8080 [ACK] Seq=17035 Ack=7311 Win=64128 Len=0 TSval=846428650 TSecr=2734222002
  255 2024-05-10 11:04:34.602062  10.244.1.18 → 10.244.1.19  TCP 510 POST /tools.descartes.teastore.recommender/rest/recommend HTTP/1.1  [TCP segment of a reassembled PDU]
  256 2024-05-10 11:04:34.602233  10.244.1.18 → 10.244.1.19  HTTP 73 POST /tools.descartes.teastore.recommender/rest/recommend HTTP/1.1  (application/json)
  257 2024-05-10 11:04:34.602377  10.244.1.19 → 10.244.1.18  TCP 68 8080 → 34396 [ACK] Seq=7311 Ack=17482 Win=64128 Len=0 TSval=2734222167 TSecr=846428814
  258 2024-05-10 11:04:34.604154  10.244.1.19 → 10.244.1.18  HTTP 283 HTTP/1.1 200   (application/json)
  259 2024-05-10 11:04:34.604198  10.244.1.18 → 10.244.1.19  TCP 68 34396 → 8080 [ACK] Seq=17482 Ack=7526 Win=64128 Len=0 TSval=846428816 TSecr=2734222168
  260 2024-05-10 11:04:34.670152  10.244.1.18 → 10.244.1.19  TCP 514 POST /tools.descartes.teastore.recommender/rest/recommend HTTP/1.1  [TCP segment of a reassembled PDU]
  261 2024-05-10 11:04:34.670213  10.244.1.18 → 10.244.1.19  HTTP 73 POST /tools.descartes.teastore.recommender/rest/recommend HTTP/1.1  (application/json)
  262 2024-05-10 11:04:34.670381  10.244.1.19 → 10.244.1.18  TCP 68 8080 → 34396 [ACK] Seq=7526 Ack=17933 Win=64128 Len=0 TSval=2734222235 TSecr=846428882
  263 2024-05-10 11:04:34.671982  10.244.1.19 → 10.244.1.18  HTTP 283 HTTP/1.1 200   (application/json)
  264 2024-05-10 11:04:34.672031  10.244.1.18 → 10.244.1.19  TCP 68 34396 → 8080 [ACK] Seq=17933 Ack=7741 Win=64128 Len=0 TSval=846428884 TSecr=2734222236
  265 2024-05-10 11:04:34.781882  10.244.1.18 → 10.244.1.19  TCP 584 POST /tools.descartes.teastore.recommender/rest/recommend HTTP/1.1  [TCP segment of a reassembled PDU]
  266 2024-05-10 11:04:34.781969  10.244.1.18 → 10.244.1.19  HTTP 73 POST /tools.descartes.teastore.recommender/rest/recommend HTTP/1.1  (application/json)
  267 2024-05-10 11:04:34.782280  10.244.1.19 → 10.244.1.18  TCP 68 8080 → 34396 [ACK] Seq=7741 Ack=18454 Win=64128 Len=0 TSval=2734222347 TSecr=846428994
  268 2024-05-10 11:04:34.784056  10.244.1.19 → 10.244.1.18  HTTP 283 HTTP/1.1 200   (application/json)
  269 2024-05-10 11:04:34.784126  10.244.1.18 → 10.244.1.19  TCP 68 34396 → 8080 [ACK] Seq=18454 Ack=7956 Win=64128 Len=0 TSval=846428996 TSecr=2734222348
  270 2024-05-10 11:04:34.853606  10.244.1.18 → 10.244.1.19  TCP 587 POST /tools.descartes.teastore.recommender/rest/recommend HTTP/1.1  [TCP segment of a reassembled PDU]
  271 2024-05-10 11:04:34.853668  10.244.1.18 → 10.244.1.19  HTTP 73 POST /tools.descartes.teastore.recommender/rest/recommend HTTP/1.1  (application/json)
  272 2024-05-10 11:04:34.853885  10.244.1.19 → 10.244.1.18  TCP 68 8080 → 34396 [ACK] Seq=7956 Ack=18978 Win=64128 Len=0 TSval=2734222418 TSecr=846429066
  273 2024-05-10 11:04:34.855465  10.244.1.19 → 10.244.1.18  HTTP 283 HTTP/1.1 200   (application/json)
  274 2024-05-10 11:04:34.855515  10.244.1.18 → 10.244.1.19  TCP 68 34396 → 8080 [ACK] Seq=18978 Ack=8171 Win=64128 Len=0 TSval=846429068 TSecr=2734222420
